{
  "mode": "renderAndValidate",
  "card_source": "catalog",
  "card_spec": {
    "template_params": {},
    "catalog_name": "readme-card",
    "asset_registry": {
      "readme-card": "card.json"
    }
  },
  "interaction": {
    "interaction_type": "ToggleVisibility",
    "action_id": "section-1",
    "card_instance_id": "card-1",
    "metadata": {
      "visible": true
    }
  }
}