{
  "mode": "validate",
  "card_source": "catalog",
  "card_spec": {
    "template_params": {},
    "catalog_name": "missing-card"
  },
  "interaction": {
    "interaction_type": "ShowCard",
    "action_id": "details",
    "card_instance_id": "card-1",
    "metadata": {
      "subcardId": "details"
    }
  }
}