{
  "mode": "renderAndValidate",
  "card_source": "asset",
  "card_spec": {
    "template_params": {},
    "asset_path": "missing.json"
  },
  "interaction": {
    "interaction_type": "ToggleVisibility",
    "action_id": "section-1",
    "card_instance_id": "card-1",
    "metadata": {
      "visible": true
    }
  }
}