{
  "mode": "validate",
  "card_source": "catalog",
  "card_spec": {
    "template_params": {},
    "catalog_name": "readme-card",
    "asset_registry": {
      "readme-card": "card.json"
    }
  },
  "interaction": {
    "interaction_type": "ShowCard",
    "action_id": "details",
    "card_instance_id": "card-1",
    "metadata": {
      "subcardId": "details"
    }
  }
}