{
  "mode": "render",
  "card_source": "catalog",
  "card_spec": {
    "template_params": {},
    "catalog_name": "missing-card"
  },
  "interaction": {
    "interaction_type": "ToggleVisibility",
    "action_id": "section-1",
    "card_instance_id": "card-1",
    "metadata": {
      "visible": true
    }
  }
}