{
  "mode": "validate",
  "card_source": "inline",
  "card_spec": {
    "template_params": {},
    "inline_json": {
      "type": "AdaptiveCard",
      "version": "1.3",
      "body": [
        {
          "type": "TextBlock",
          "text": "${payload.count == 1 ? \"one\" : \"many\"}"
        }
      ]
    }
  },
  "interaction": {
    "interaction_type": "ToggleVisibility",
    "action_id": "section-1",
    "card_instance_id": "card-1",
    "metadata": {
      "visible": true
    }
  },
  "payload": {
    "count": 1
  }
}