{
  "mode": "renderAndValidate",
  "card_source": "catalog",
  "card_spec": {
    "template_params": {},
    "catalog_name": "missing-card"
  },
  "interaction": {
    "interaction_type": "Submit",
    "action_id": "save",
    "card_instance_id": "card-1",
    "raw_inputs": {
      "comment": "ok"
    }
  }
}