{
  "mode": "renderAndValidate",
  "card_source": "inline",
  "card_spec": {
    "template_params": {},
    "inline_json": {
      "type": "AdaptiveCard",
      "version": "1.3",
      "body": [
        {
          "type": "TextBlock",
          "text": "${payload.count == 1 ? \"one\" : \"many\"}"
        }
      ]
    }
  },
  "payload": {
    "count": 1
  }
}