{
  "mode": "renderAndValidate",
  "card_source": "inline",
  "card_spec": {
    "template_params": {},
    "inline_json": {
      "type": "AdaptiveCard",
      "version": "1.3",
      "body": [
        {
          "type": "TextBlock",
          "text": "Hello @{payload.title}"
        }
      ]
    }
  },
  "payload": {
    "title": "World"
  }
}