{
  "mode": "render",
  "card_source": "inline",
  "card_spec": {
    "template_params": {},
    "inline_json": {
      "type": "AdaptiveCard",
      "version": "1.3",
      "body": [
        {
          "type": "TextBlock",
          "text": "Hello @{payload.title}"
        }
      ]
    }
  },
  "interaction": {
    "interaction_type": "ShowCard",
    "action_id": "details",
    "card_instance_id": "card-1",
    "metadata": {
      "subcardId": "details"
    }
  },
  "payload": {
    "title": "World"
  }
}